{
  "group_contacts": [
    {
      "name": "Lowell",
      "id": 5
    }
  ],
  "private_contacts": [],
  "dmr_ids": [
    {
      "name": "KO6ENZ",
      "id": 5
    },
    {
      "name": "Lowell",
      "id": 5
    }
  ],
  "default_dmr_id": "KO6ENZ",
  "zones": [
    {
      "name": "Mount Sutro",
      "channels": [
        {
          "name": "W6PW",
          "type": "digital",
          "uplink": 555.555,
          "downlink": 555.555,
          "uplink_cs": 1.0,
          "ts2_contacts": [
            "Worldwide",
            "NorCal"
          ]
        }
      ]
    },
    {
      "name": "Lowell",
      "channels": [
        {
          "name": "LWL",
          "type": "digital",
          "uplink": 555.555,
          "downlink": 555.555,
          "dmr_id": "Lowell",
          "ts1_contacts": [
            "Lowell"
          ]
        }
      ]
    }
  ]
}